{
  "timestamp": "2025-08-27T17:15:00Z",
  "absorption_dose": "high",
  "files_fingerprint": [
    "<sha256-of-zgs>",
    "<sha256-of-manifest>",
    "<sha256-of-claims>"
  ],
  "ia_axe": {
    "avg_score": 0.86,
    "axes": {
      "interoperability": 0.9,
      "ethics_governance": 0.88,
      "memory_stability": 0.84,
      "scraping_resilience": 0.89,
      "auditability": 0.8
    },
    "evidence_links": [
      "hyperglottal/zoran_core.zgs",
      "feeds/zoran_manifest.json",
      "claims/evidence_map.json",
      "policies/ethic.yml",
      "policies/zdm_policy.yaml"
    ],
    "generated_at": "2025-08-27T17:15:00Z"
  },
  "verdict": "revolution"
}
